,rating,title,comment,date,country
642,5.0,TI Calculators are the BEST,This is the second scientific calculator I've bought from TI (not to mention a graphics and financial calculator).  I love how this has two lines on it and you can scroll up and down.  It continues to work great!,"April 25, 2013",the United States
643,5.0,"Quality product, great for kids advancing in Math","Great product for my son to visit use as he is advancing in Math.  Solidly built, easy to use.","February 21, 2019",the United States
644,5.0,Great calculator for the price,What a life saver when taking a Physics course.  Helped me get all of my calculations correct.,"June 1, 2018",the United States
645,5.0,Great,Exactly as described,"October 8, 2019",the United States
646,5.0,Calculator for Math 143,"Many colors are available in this product, Easy to use, Brought with a protective cover/case","October 13, 2021",the United States
647,5.0,Great calculator!,"Great calculator!!.  It was simple to use, inexpensive and had everything I needed for my statistics class.  The only thing it was lacking was it needed someone to show me how it works.","November 16, 2015",the United States
648,5.0,It's a good buy,Works great great price,"September 30, 2019",the United States
649,5.0,"Can you 'Love"" an calculator?","I don't really 'love it', but it does complicated math and is distinctive enough I can catch those hobos that try and take my calculator.  Thus far, nothing has fallen off, worn away or cracked.  Yay?","June 25, 2014",the United States
650,5.0,Works great,Works great,"November 10, 2020",the United States
651,5.0,Good for math class,Great for value,"October 29, 2019",the United States
652,5.0,Works as expected,Works as expected,"October 27, 2019",the United States
653,5.0,Great deal,This calculator is the one my daughter needed for 6th grade this year. I like it because it's a great price and my daughter likes it because it comes in different colors. This is a great buy for us.,"September 25, 2014",the United States
654,5.0,as shown,as described,"October 4, 2019",the United States
655,5.0,Easy to use,Just as described.,"September 6, 2019",the United States
656,5.0,"Good calculator, but you need to know how to use it",A good calculator with many functions. I would suggest watching a video on using this calculator so that you can use it to its fullest potential.,"February 24, 2017",the United States
657,5.0,Easy and simple for college accounting and finance class,Works great for my accounting and finance exams,"May 15, 2020",the United States
658,5.0,This is a great everyday user calculator for a better price than you ...,This is a great everyday user calculator for a better price than you can get in stores.  I keep this one on my desk at work and use it daily.  Just bought one for my daughter to use in 7th grade.,"August 28, 2014",the United States
659,5.0,Great calculator for chemistry,I mean it’s a calculator so there’s not much to review on it but it’s really easy to use and comes with very detailed instructions,"September 18, 2019",the United States
660,5.0,Fantastic Calculator,I've been using this calculator for years and I love it. I recently bought a new one because I spilled melted sugar on my old one and the buttons on it stopped working (but understandably so)...,"February 10, 2016",the United States
661,5.0,Can't believe that I had to purchase this for our ...,Can't believe that I had to purchase this for our teenager for school ....but it's getting the job done.,"February 21, 2018",the United States
662,5.0,Its pink and handy,Very useful. I bought it for my son and he said he doesn't mind the color because his math is getting hards and pink is just a color.,"May 8, 2017",the United States
663,5.0,Works like it should,I got it because of the color. It works for my statistics class.,"January 9, 2019",the United States
664,5.0,Great Device!,I love this calculater. Got this for college Alegbra and it does wonderfully.,"September 13, 2018",the United States
665,5.0,Calculator,Great price cheaper than in store,"December 5, 2019",the United States
666,5.0,Great calculator; misleading picture/description,"I love this calculator and recommend it to any one needing a scientific calculator.  However, I am disappointed that it is not the color shown in the picture.  It is listed as ""Black"" and the picture shows this, but I was clearly sent a ""dark blue"" or ""navy blue"" calculator.  I specifically ordered this for the color and am displeased by the misleading description and picture.","July 25, 2013",the United States
667,5.0,TI-30X fro Trig,Reliable calculator for all purposes.  My son uses it for his math class and said his teacher recommened it.  He seems to like and it works for Triganometry.,"June 6, 2016",the United States
668,5.0,Awesome 👌,Great item worth every penny!!!,"April 24, 2020",the United States
669,5.0,For 7th Grader,My daughter's teacher requested this calculator for her math class. It is easy to use and read the screen. Value worth what I spent. I'm very pleased.,"December 20, 2020",the United States
670,5.0,A must-have in any backpack or toolbag. Very light ...,A must-have in any backpack or toolbag.  Very light and has nearly everything you could need.  Solar panel on top means battery will probably never need to be replaced.,"February 13, 2016",the United States
671,5.0,For school,Bought for my child. No complaints so far,"November 16, 2019",the United States
672,5.0,Great price compared to other places!,"Purchased this for our son for school. Great price, &amp; has worked great.","October 20, 2018",the United States
673,5.0,Accuracy is good. Keypad is great even after 6 years of ...,Works as advertised. Have nothing to complain. Accuracy is good. Keypad is great even after 6 years of moderate use. No complaints with the screen. Till now the screen has no scratched and the display is also good. Good reliable product.,"September 6, 2015",the United States
674,5.0,A is for Algebra,"Less money than the stores around here, but my son has hardly used it. So was it worth the purchase? I don't know. At least he has an A in Algebra.","November 10, 2016",the United States
675,5.0,It's Good.,It's Good.,"October 1, 2019",the United States
676,5.0,Great for basic scientific work,This is a great item for basic scientific calculations. It does not do all the functions of the somewhat higher models in the product line but meets my needs just right. And a great bargain at less than $13.,"December 17, 2012",the United States
677,5.0,big fan of TI's,nothing to dislike. already a big fan of TI since childhood.,"October 28, 2021",the United States
678,5.0,Love this calculator,Love this calculator.  Needed one for a college class and loved that I could add some color to my supplies.  It works great too,"May 11, 2017",the United States
679,5.0,great price,great item,"November 4, 2019",the United States
680,5.0,She loves the color. Too bad she never used it! 🤣,Her teacher made us get it and she never used it. Oh well!  It works well in the House!,"June 11, 2018",the United States
681,5.0,Was well priced and has the protective plastic case so that helps lengthen the life in a busy house like ours.,Working well for our two high schoolers.  Would buy again. Was well priced and has the protective plastic case so that helps lengthen the life in a busy house like ours.,"December 14, 2015",the United States
682,5.0,Perfect for those in high school or even getting into ...,Product is well made and you should expect no less from Texas instruments. Perfect for those in high school or even getting into college mathmatics.,"January 16, 2018",the United States
683,5.0,Is what it says...,"I used this for the appropriate algebra courses and more. It's a fine device, and worth whatever reasonable price. I had to upgrade to the Ti-84 before learning how to only use a fraction of the Ti-30 capabilities.","January 9, 2014",the United States
684,5.0,Great price,Great price.,"September 12, 2019",the United States
685,5.0,Good for HS Math,This is one of the best calculators for a high school math class. This is the calculator I recommend to my students.,"December 21, 2019",the United States
686,5.0,Great product,I love TI calculators. This will be perfect for my daughter that is in 7th grade,"July 26, 2018",the United States
687,5.0,Good.,It works fine.,"April 16, 2020",the United States
688,5.0,Works great,Works great for my daughter in school and cheaper than target!!,"October 21, 2018",the United States
689,5.0,Good value,Good calcular with nice features for the cost. I wish it was easier to delete one character mid problem without deleting everything after that character too.,"December 11, 2019",the United States
690,5.0,Great buy...,Great buy for my teenager. I was shocked as this calculator looks almost the same and has alot of the same functions as my $150 scientific calculator i bought for college. It is very nice for the price!,"March 6, 2015",the United States
691,5.0,better than Casio,"Build quality is way better than the Casio fx-115es...buttons are precise, not 'flimsy' as with the Casio...it feels substantial, like it's made to last 20 years.","August 6, 2016",the United States
692,5.0,Great value,Great value!  I bought 2.  They were in original packaging and work well.,"September 12, 2018",the United States
693,5.0,Best price anywhere,Was required item for school this year for my 7th grader. Best price anywhere.,"August 3, 2018",the United States
694,5.0,It works.,I bought this so my son would have the same calculators they use at school for homework. No complaints. It adds and does all sorts of math things as required.,"May 3, 2016",the United States
695,5.0,For ACS test!,"Works as described, purchased for ACS Exams.","June 8, 2019",the United States
696,5.0,Girls and math...Yeah!,My teenage daughter started using the calculator as soon as it arrived...loves the color. Girls and math...Yeah!,"August 13, 2017",the United States
697,5.0,Calculator TI30x,Calculator is perfect for the high schooler who has a diverse class load - it has a myriad of uses for different classes from science to math. It covers more bases than the other calculators and is very hard to break.,"October 24, 2010",the United States
698,5.0,It works perfect no issues and you can't beat the price,I don't know how ibwoukd get through math class without this item. It works perfect no issues and you can't beat the price.,"February 3, 2018",the United States
699,5.0,Fantastic product,My daughter was so scared to use this going into the 7th grade but she now loves it! Especially the fact that it was pink. I would highly recommend this calculator to anyone! Super fast delivery as well! Also was quite cheaper than buying one in a store!,"July 20, 2018",the United States
700,5.0,Favorite calculator,Easy to use and compact,"June 19, 2019",the United States
701,5.0,Standard calculator will buy again,Great quality and durability bought it as a gift,"January 13, 2019",the United States
702,5.0,Customer service great,Thank you for shipping out missing one so fast.Good Quality,"July 27, 2019",the United States
703,5.0,Second-hand review,"Bought this for a 50+ year old surveyor/engineer whose last calculator was worse than an abacus.Although he's very confused, he can do everything he needs a scientific to do and he learns more.","April 21, 2013",the United States
704,5.0,Good buy,My son needed for his class which worked great.,"January 25, 2019",the United States
705,5.0,Must have for college algebra,Great price,"October 26, 2019",the United States
706,5.0,Great product!,Daughter uses it for 9th grade math. No complaints. Easy to use.,"December 22, 2019",the United States
707,5.0,"My daughter loved the pink color, works for everything she needs in 6th grade!","Beautiful pink color, great value for the money and works great!","November 18, 2018",the United States
708,5.0,No batteries!,"Love this little calculator.....small, compact, and no need to worry about batteries!","August 16, 2018",the United States
709,5.0,Great product for a low cost,"My kids use this every night for their homework, and they each have one in school as well. The low price makes me not worry if they lose them. Lots of functionality.","December 2, 2015",the United States
710,5.0,It's exactly what I needed. Thank you for saving ...,It's exactly what I needed. Thank you for saving my a**I needed this for school last minute and it got here so fast. Bless u,"January 12, 2018",the United States
711,5.0,I bought this calculator to use in my business math ...,I bought this calculator to use in my business math course and it worked perfectly for everything I needed it for.,"June 7, 2018",the United States
712,5.0,"one of the easiest to use scientific calculators,","one of the easiest to use scientific calculators , and they last I was replacing a TI-30  solar that was more than 10 years old that did finally die","July 1, 2016",the United States
713,5.0,Great and durable,Has held up through years of high school and college!,"October 24, 2019",the United States
714,5.0,Back to School,"I bought this for my niece. She is starting the fifth grade.  It is hard to review since she does not start school until September 7.  She seems to like it, recommend by her teacher","August 21, 2016",the United States
715,5.0,It's perfect for my college chemistry and math courses,What can I say I am a girly girl and  I had to have a pink calculator. Don't let the color fool you though it's a real functioning calculator. It's perfect for my college chemistry and math courses. I'm overall super happy with this product.,"June 28, 2016",the United States
716,5.0,I liked it,"I bought it and I liked it, what else can I say. Thank you","January 2, 2019",the United States
717,5.0,Nice and easy to use for my HS son,It is nice ; display easy to read....was cheaper at Target!!!!,"October 6, 2018",the United States
718,5.0,Trusty Calculator,My middle schooler uses it everyday in class. No issues,"December 6, 2018",the United States
719,5.0,Would recommend.,"It's a solid calculator, no issues with it at all. Would recommend for 5th grade and up, so whenever a teacher says you need a scientific calculator to start this is the one you should get. If you're looking for a simpler calculator, the TI 30xa works well for 10-13 year olds, but as they get older they'll probably need a display that's easier to read, so it's best to just have this from the start.","August 26, 2015",the United States
720,5.0,College required/ acceptable,It is exactly what I needed for my College Algebra class.,"February 20, 2020",the United States
721,5.0,Perfect,Fit perfect right out of the box.  Exact duplicate to the original from BMW for 1/3 the cost from the dealer. Replaced in less that 15minutes.,"August 12, 2018",the United States
722,5.0,It's A Calculator,There's really not much to write about this product. It's a calculator that does its defined job very well and for a good price too. No issues with it in the month I've used it.,"February 26, 2020",the United States
723,5.0,Great calulator,"For the price point, can't argue anything wrong about this thing. Works perfectly and is still holding up to this day","November 4, 2018",the United States
724,5.0,Great!,Great for college!,"August 10, 2019",the United States
725,5.0,Perfect calculator,It’s a calculator and it does everything as advertised.,"December 27, 2019",the United States
726,5.0,First one lasted 20+ years!,"2nd one I bought. First one lasted 20+ years! Best price I could find, to replace Old-Dependable :)","March 19, 2018",the United States
727,5.0,For Those Picky Professors,Fully Functional Calculator and it does well to serve me on classes that prohibits the use of graphic calculators.,"September 3, 2017",the United States
728,5.0,Awesome,"Bought this for middle school math class, works great","December 26, 2018",the United States
729,5.0,As advertised,As advertised,"September 4, 2019",the United States
730,5.0,Simple. Easy. Nice.,Needed it for chemistry. Same as you would get in the store. Easy.,"March 15, 2021",the United States
731,5.0,can't beat the price! does exactly what i needed ...,can't beat the price! does exactly what i needed it to do and i was able to find tutorials online for this model telling me exactly how to use the 2nd functions.,"December 17, 2015",the United States
732,5.0,Scientific calculator for undergrad courses,Good packaging arrived on time and working fine.,"May 19, 2020",the United States
733,5.0,Good,Worka grate. Exactly what middle schoolers need good,"December 31, 2018",the United States
734,5.0,Great product,Great product,"November 3, 2019",the United States
735,5.0,Easy to use,"This calculator is great. I use it for everything. It is solar powered, so there's no need to worry about battery power or battery leaks. It's pretty straight forward and easy to use. I bought it for school and it works for most things.","February 10, 2016",the United States
736,5.0,For the price can't beat,Love the color and for the price you can't beat this texas instrument scientific calculator. Love that the case slips over to cover and protect the buttons and solar power is always awesome.,"September 18, 2013",the United States
737,5.0,Nice price,Works great,"September 4, 2019",the United States
738,5.0,Works great,This calculator is easy to use and works great for what I need,"October 13, 2018",the United States
739,5.0,Great simple calculator,Use it for my accounting work.,"April 24, 2020",the United States
740,5.0,Perfect for college!,I have been using this exact model for 4 years in college now and have only had to replace the batteries once. Very pretty and high quality.,"December 7, 2016",the United States
741,5.0,Great calculator,"Used this in class. Felt like Elle Woods in Legally Blonde, but it was an awesome calculator.","February 1, 2018",the United States
742,5.0,Great product at a very reasonable price.,Just what my son needed for high school math.,"February 1, 2019",the United States
743,5.0,Just what I needed.,Just what I needed for school. Works great. About the size of a smart phone. Light-weight.,"February 26, 2018",the United States
744,5.0,Love it!,I absolutely love this calculator. It has helped me through my awful college math class. Did everything I needed! I first had the one under this version and it was absolutely terrible.,"August 13, 2014",the United States
745,5.0,Works very good and it is good quality,Works great for a great price,"November 5, 2019",the United States
746,5.0,Nice calculator for price,Purchased for school-works as advertised and ata great price,"October 15, 2018",the United States
747,5.0,Recommend it,I like it!,"September 4, 2019",the United States
748,5.0,Great product,Works great,"December 14, 2019",the United States
749,5.0,Useful &amp; Cute!,"I didn't want to spend a ton of money on something I would only use for 2 classes.  This was perfect.  It meets my college's requirements and it's pretty!  Also quite sturdy, I have dropped it a few times on my hardwood floors and there is no damage :-).","January 26, 2011",the United States
750,5.0,Good,Good,"August 25, 2019",the United States
751,5.0,Nice price for a nice calculator.,Really good price for a calculator that does what it is supposed to do. This is required for my college chemistry and physics courses and I needed something light and basic. This def fits the bill.,"August 23, 2012",the United States
752,5.0,Five Stars,Perfect for my math class! Does what it needs to do! Cheap and super fast shipping!,"March 5, 2018",the United States
753,5.0,Best purchase ever,"Best purchase ever, I  love the new calculator I bought","June 3, 2022",the United States
754,5.0,.,This is the calcualtor my son was required to have for school.,"September 21, 2018",the United States
755,5.0,Awesome for the price!,This product is great! I bought it for my class and my students found them easy to work.,"December 26, 2019",the United States
756,5.0,Easy to use,Easy to use,"February 18, 2020",the United States
757,5.0,Perfect,Perfect,"September 18, 2019",the United States
758,5.0,Worked great,Was great for my class where the teacher wouldn't allow graphing calculators for tests.,"April 27, 2018",the United States
759,5.0,"Very good, stable product","Not the most sophisticated product, but if you want more features, you have to pay more. Very good, stable product. No issues with it whatsoever.","October 15, 2016",the United States
760,5.0,Five Stars,My son needed this for school. It does what it is supposed to do and has held up well.,"February 2, 2018",the United States
761,5.0,Perfect Calculator for My 7th Grader!,Perfect calculator for my 7th grader. Ordered the case too. Math teacher was pleased that we chose this calculator.,"September 28, 2017",the United States
762,5.0,Great calculator for the price!,This calculator is better than I thought! It can do everything from parentheses to exponents and everything in between. Overall a great purchase for only $12.99.,"September 29, 2015",the United States
763,5.0,Funcionamiento,"Es rosa pero funciona como el color gris oscuro, funcionan bien si sabes usarla o aprender, las instrucciones están en la tapa.","September 15, 2019",the United States
764,5.0,Five Stars,Very nice basic calculator. Great for easy calcs. NCESS approved for the PE,"June 1, 2018",the United States
765,5.0,Nothing bad to say - I just needed the high level calculator TI-84,For what I bought it does perform to its capability. I really needed the TI-84. I just have never thought about returning it.,"May 15, 2017",the United States
766,5.0,Grewt,Great,"September 16, 2019",the United States
767,5.0,Good,Looks like pictures. Needed for my son in 7th grade.,"November 18, 2018",the United States
768,5.0,Great calculator.,"So easy to read and it arrived so quick, which was a Godsend.  My teen needed it, that week.Thank you.","March 8, 2020",the United States
769,5.0,best calculator! use this in my lab coat pocket,best calculator! use this in my lab coat pocket. Love this calculator because you can scroll through the entire equation.,"June 29, 2016",the United States
770,5.0,Rasberry Scientific Calculator,This is great already bought a black one for my son and now the rasberry for my daughter. Came fast works great and awesome price! Thanks,"September 4, 2016",the United States
771,5.0,"Product arrived as described, and is exactly what I ...","Product arrived as described, and is exactly what I was expecting when making my purchase. Thank you very much. God Bless","March 20, 2017",the United States
772,5.0,Great,Bought for my sound math class. Works great,"November 12, 2019",the United States
773,5.0,Great product,Just a basic calculator! Works great,"February 7, 2019",the United States
774,5.0,Best Calculator Ever!,Best calculator ever!,"February 28, 2020",the United States
775,5.0,It's What I Needed,"I like this calculator because it feels good in my hand, is very reliable, is cost-effective, and has all the functions I need for my chemistry and statistics classes.-Pinprick Society","December 19, 2013",the United States
776,5.0,and love the 2-Line Scientific Calculator,"I'm a machinist and have used this for years, and love the  2-Line Scientific Calculator.My old had been dropped one two many times so i was on my back up ti-30 solar.","November 19, 2014",the United States
777,5.0,Great for small math problems,Great for the price and worth it for college,"July 2, 2020",the United States
778,5.0,"Works, so that's good","Seems well made, works, required for my child's school","September 20, 2018",the United States
779,5.0,"Quickly shipped, durable..","Just as needed, it is what is stated. Son uses at school and hasn't had a problem yet, and he is rough on things. Shipping is fast.","October 10, 2018",the United States
780,5.0,"Affordable calculator, plus very appealing, definitely got compliments ...","Affordable calculator, plus very appealing, definitely got compliments on it. The battery is reliable as it is solar powered.","April 30, 2018",the United States
781,5.0,Works well and price was right,"I bought this for a college math class. I didn't want to buy a high end calculator, but this one does what I need it to do.","May 30, 2020",the United States
782,5.0,"Sturdy, will last years and years and years",Classic and beautiful. Can’t get any better than this.,"November 16, 2018",the United States
783,5.0,Everything,"Everything and I use it when I go to the store, to kee a track of my balance in the bank, etc","June 29, 2020",the United States
784,5.0,Great instrument,It helped me pass my applied math class! Yea!!!,"December 9, 2018",the United States
785,5.0,Five Stars,"This calculator is the same type i've been using for 15 years, ol' trusty!","April 14, 2018",the United States
786,5.0,Geometry Class,Geometry class need-great experience and purchase.,"October 4, 2019",the United States
787,5.0,Good product,This scientific calculator has all the feature you need to do what you need for high school math classes and most college course. It is also simple enough for basic calculation.,"May 15, 2014",the United States
788,5.0,Excellent Quality,Texas Instruments never disappoints. Well made,"December 10, 2019",the United States
789,5.0,The perfect math tool,The best calculator I’ve ever had. Works perfectly for all math classes.,"May 23, 2018",the United States
790,5.0,Great,For my child start to Highschool,"March 9, 2019",the United States
791,5.0,TI-30X IIS,"It was required for my 8th grade Granddaughter.  Her comments: ""It's working amazingly!""  I think she like it.  :-)","September 7, 2017",the United States
792,5.0,Lifesaver,"This calculator has been a lifesaver in my math class, and I love the color.  It's easy to use and the commands are clear on the keys.","September 26, 2016",the United States
