,rating,title,comment,date,country
2964,5.0,"Good calculator, works well","Good calculator, works well. I came in good condition. I bought this because I am taking a class where I'm not allowed to use my TI-84.","June 8, 2018",the United States
2965,4.0,"Almost just what I needed, wish there was a cover with it",Needed this for a statistics class in university. The buttons aren't as sensitive as I'd like but I'm pretty sure that's a common issue of this model and it's not a huge deal because I need to check my numbers carefully anyway. I bought mine used so there was some scratch damage but nothing dramatic enough to hinder its use. I didn't realize it wouldn't come without a cover though.,"April 4, 2014",the United States
2966,4.0,This is a great product,"I was told to get a non-programmable calculator because the school doesn't want you to be able to encode equations in it that could help you cheat on a test. However I realized after buying it that it maintains a record of all calculations. Therefore, it actually is programmable. Despite this, there is a memory-wipe function so it can be made to conform with my prof's requirements.","March 7, 2014",the United States
2967,3.0,"Buttons require ""heavy"" touch","My calculus teacher did not allow graphing or calculators that could display more than two lines, so I ordered this one. I don't know if it's just the one I got or they're all like that, but the buttons on mine were a bit difficult to press. I had to press very deliberately in order for the numbers to input on the screen. If I was trying to type the numbers in very fast and I didn't press the numbers hard enough, it would skip numbers.  I've had calculators that only required light touch, so this was a negative for me.  I kept it just because returning was a hassle  and I needed it for my class :/","January 17, 2015",the United States
2968,4.0,Great little calculator!,"This calculator looks and works great. Honestly, the only problem I have with this at all is that the buttons are sticky and sometimes won't press when you hit them. I had this problem on my old TI-30X IIS calculator too, so I assume it's a manufacturing issue. However, this works great for classes that won't allow programmable calculators!","May 7, 2014",the United States
2969,3.0,Three Stars,Good basic calculator,"January 5, 2015",the United States
2970,4.0,It would be nice if the key action was a little more sensitive,"It does the job and it's a very entertaining color. The buttons sometimes stick and the action is slow and unpredictable. It would be nice if the key action was a little more sensitive. Otherwise, it's a TI calculator and it's hot pink. Got me through my Algebra class with ease.","September 10, 2017",the United States
2971,5.0,Five Stars,Very good for school,"October 3, 2014",the United States
2972,4.0,Wish the screen was larger,Classic calculator. Nice look and feel. One downside is the numbers are so large on the screen that long calculations stretching beyond the screen boundaries that contain many parenthesis are a headache to construct and proofread.,"September 24, 2020",the United States
2973,4.0,Helped me pass my HAM Technician test,Nice multi-line calculator with all the standard functions.I only needed a calculator for maybe 2 questions on the HAM license exam.Now I will save it for the coming Apocalypse.  ;-),"January 24, 2019",the United States
2974,4.0,Easy to use and read calculator!,This calculator does a Great Job at a very inexpensive price!,"April 27, 2021",the United States
2975,5.0,Five Stars,Very satisfied,"January 10, 2015",the United States
2976,3.0,Products broke in 3 days,It was good at first but suddenly everytime I type a problem and press enter it shows error. Thats bc when I press enter it enters (/) by it self so it’s always an error.,"February 18, 2022",the United States
2977,5.0,Perfecto!,Exactly as the syllabus required for 9th grade algebra....makes life so much easier providing the teachers let the kids use them now!,"August 13, 2013",the United States
2978,4.0,"Good calculator, need it for college, buttons kinda suck though!","I spent all of high school thinking my graphing calculator was all I would use in college and that I'd never need my scientific, so I gave it to my younger sister. Turns out, college is terrible and they like to make you buy stuff. My science classes required a non-programmable scientific calculator, recommending this particular model. It was being sold for something like 18 dollars at the bookstore. Luckily, it's half that price online! It's a fine calculator, works as needed, but the buttons sometimes stick or don't press down and mess with my calculations. Drives me crazy. That's the only reason for the 4 star rating. Pay attention to what you type, make sure it's correct!","September 13, 2017",the United States
2979,4.0,Great.,"Works great, looks good and arrived fast in its original package unopened. Very happy.I just wish the product had the capacity to perform higher level calculations though.Thanks.","September 12, 2013",the United States
2980,4.0,Great and simple calculator,"Very easy to use and learn, and works well. Works best through middle school and 9/10th grade. Lacks a few functions though","June 30, 2022",the United States
2981,4.0,Not what is shown in the picture!,"I ordered this calculator for an Algebra class at school. I thought it was a pretty pink color with a modern floral design (even though im not really a pink girl but i wanted a bright color for it to stand out from regular black or grey ones) I really liked the floral design but, alas, NO FLORAL DESIGN!!!  it is plain pink with a white square around the screen instead. Very disappointing. If you no longer offer the floral calculator then change the picture! And according to the previous reviews i'm not the first person this has happened too so be aware! If the calculator looked the same as the photo then i might haven given it more stars.NB: Since writing my first review i would like to add that i was contacted by the seller who assured me that they are going change the photo as they no longer make the floral pink design's. I was sent a check for a 50% refund for the trouble. I have been using the calculator at school over the past 2 weeks and i actually think it's a great calculator. It does lots of cool functions to make Algebra easier to manage and i have lots of jealous girls in my class that love pink color. So changed my rating from 2/5 to 4/5.","February 16, 2012",the United States
2982,5.0,Exact model required for my son's math class,"Solar powered, large display","September 10, 2019",the United States
2983,4.0,Nice Scientific Calculator,"I got this about four months ago. Recently I thought it was broken because it got a syntax error each time I plugged in a problem, but all I had to do was reset it and it was fine. It has natural log and exponential e, unlike a pocket calculator.","November 17, 2018",the United States
2984,4.0,Its a calculator,It's a calculator it calculates things and it does it alright but you have to space the number presses or they won't register,"March 30, 2022",the United States
2985,4.0,Good unit.,"Solar powered with battery backup. Works well. I bought this case for it:
co2CREA Carrying Travel Storage Organizer Case Bag for Texas Instruments TI-30Xa/TI-30X IIS 2-Line Scientific Calculator","September 9, 2017",the United States
2986,3.0,Average calculator,"If you're needing a bulk of calculators for a classroom this will do. Other than that, if you're in need of a calculator for test taking purposes, spend the extra couple bucks and buy the TI-30XS. The button functions are a lot more consistent and have the multi-view which was super helpful.","February 2, 2020",the United States
2987,1.0,"This one must be defective, or these just really SUCK!","Ok, so I thought, Texas instruments,  this price is too good to be true... I was right. This calculator feels cheaply made, the buttons do not register your pushing on them half the time, it randomly turns off and back on. This thing was such a detriment to my schooling. Due to the many missed punch inputs, my math exams sucked. I had to eventually just forget about trying to use this piece of junk... I had to use my phone. This is one of the most disappointing purchases I have had in a very long time. Spend a little more money and get a better calculator. This thing isn't even worth the effort to return it. Totally sucks.","August 22, 2021",the United States
2988,4.0,"Good calculator, but not the color I ordered","Pros:  This is a good calculator with intuitive buttons. Not much to say here - it's a calculator and it works.Cons:  I ordered a black calculator from the seller SchoolMart but received a red one. If you're one of those people that cares about the color of your calculator, you may want to try a different seller.","November 1, 2020",the United States
2989,4.0,Works well,Great price,"July 10, 2021",the United States
2990,4.0,Calculate this!,"I got this for a graduate level stats class. It came super quickly, and I've been using it for a couple of weeks. Let's break it down:Pros:I love the pink color!It is fairly user friendly, as all items are labeled.It's the perfect size. It fits right in my bag without taking up any space.The second functions are so much better laid out than others I've seen.The amount of functions this small calculator can do is pretty impressive. Makes hypothesis testing much easier!Cons:The buttons are a bit weird to get used to. Sometimes it feels like you push them and other times it doesn't. Strange.The cover is incredibly difficult to get on and off.It has a limitation for the amount of numbers you can input at a time.The screen shows latest calculations; I miss the the graphic calculator that shows me everything I've done.Overall, this was great for the price, and I would purchase another one!","May 9, 2016",the United States
2991,3.0,Not sure about this!,"Maybe it's just me, but the calculator seems a bit complicated. It is not easy to use or learn. It seemed that more instructions instead of the piece of paper should have came with the product. However, the fonts are easy to read on the calculator and screen.","July 30, 2020",the United States
2992,4.0,I like the calculator but some of the buttons need to ...,I like the calculator but some of the buttons need to be pressed harder than others or the number won't type so I have to be careful or I will make an error.I like that I can review previous calculations and edit my calculation to change an error or change a variable. The pink color is a bonus.,"November 30, 2015",the United States
2993,3.0,Get what you pay for....it works,The calculator works just fine.  However I do not like the cheap feel to the buttons.  They feel loose and sometimes when pressed it does not register the number on the screen.  I have to make sure I double check every number as I enter them.  Slows down calculating a bunch of numbers at once.,"August 21, 2020",the United States
2994,5.0,Five Stars,Bought for my son for school. Seems to be what he needs.,"November 8, 2017",the United States
2995,4.0,but too bad colleges dont want u programming stuff on your calculator ...,"I needed a TI-84 replacement - the TI84 was the ultimate calculator for me, but too bad colleges dont want u programming stuff on your calculator for exams? I don't know. I needed a calculator that is college able without being banned and with having a full line of input where I can type an entire expression without wondering what the heck was going on. This does the job, but I have to say that the buttons are a little stiff to press (in comparison to the TI84) Not necessarily a bad thing for some people, but its my review and im a little dissatisified with it. otherwise, great calculator","January 22, 2016",the United States
2996,4.0,Easily portable and easy to use.,"Since my daughter was not allowed to use her iPhone as a scientific calculator in her class, we got her this. She says it's easy to use and I think that Texas Instruments id the best.","November 28, 2018",the United States
2997,5.0,Worth buying,Everything was great with the calculator,"November 22, 2019",the United States
2998,4.0,"but the battery life finally has gotten too annoying,. so this is probably a 5 star ...","i've actually never used this calc yet. i have always used the ti30x battery powered model. only going to this solar one because the battery life in the ti30x is less than a year now. the first model i bought had one battery and lasted 14 years. the next two i bought had 2 batteries instead of one yet they lasted only two years. thing is if you find two batteries to replace the old ones they cost more than a new calc with two new batteries. I use geometry and trig all the time for work and stuck with the t30x for years becuase all the function buttons remained in the same place for all these years.but the battery life finally has gotten too annoying ,. so this is probably a 5 star product, i just have to see if it works for longer than previous models.","July 30, 2014",the United States
2999,4.0,The buttons are not like the TI-84,"The buttons are not like the TI-84, which bothers me because these are more clicky clacky. Also I would sometimes mistype equations because I thought I had pressed a button but maybe didn't or pressed the wrong one. If they changed the buttons this would be a perfect on-the-go calculator. I am a physics/engineering student","July 31, 2016",the United States
3000,4.0,Pretty darn good!,It’s a nice little calculator. I like that it was in a fun color but I still can’t figure out exponents on it ... it’s just not very intuitive. I still enjoy it though.,"February 21, 2020",the United States
3001,5.0,Five Stars,Great product!,"June 23, 2016",the United States
3002,4.0,Nice Little Scientific Calculator,"Nice little scientific calculator. My daughter indicated that the instructions on how to use some of the functions are very confusing. She gives it a 4 star because of that, she loves the color. It's not the newest one out there, but has helped with her math this year.","October 3, 2016",the United States
3003,1.0,I didn't get what I ordered.,What I got wasn't even pink and was the basic version of this model. I'm not sure if it was a mistake or I got ripped off. I just want what I ordered. :(,"May 24, 2014",the United States
3004,5.0,Five Stars,works perfectly and was way cheaper than at our school store.,"May 24, 2017",the United States
3005,3.0,It's just okay,"This is my third Texas Instruments calculator.  I also have a TI-84 and a Voyage 200, both of which I love.  I bought this one because I needed a no-frills scientific calculator for my Diff Eq class.  I didn't have a lot of money to spend, so this one seemed to fit the bill.  I wish I had gone to a bricks and mortar store and tried it against some other ones, though.  It has all the functions I want, including storing the previous answer, but the buttons don't always register a key press.  It is really frustrating to be in the middle of a test and have the calculator get temperamental.  It is especially bad when I don't notice it happened and mess up a problem because the button didn't register.  It's not an issue with the buttons being difficult to press, either.  The button presses just don't get picked up some times.","March 29, 2010",the United States
3006,4.0,Great device for the classroom,Bought this for my Middle School son and he's finds it perfect for the classroom.  This is the exact model that the teacher uses so there is no confusion about button location or procedures.  Just the right size to carry around school as well.  Price was quite fair when compared to similar models available in brick and mortar stores.,"October 12, 2011",the United States
3007,4.0,Keystone Exam Ready,"The item is cost effective and offers convenience, results and savings on my wallet. Purchased to help my child with homework and Keystone Exams.","February 18, 2020",the United States
3008,5.0,Five Stars,good,"February 10, 2017",the United States
3009,4.0,"Simple, solid scientific calculator, sometimes misses buttons presses","Needed this for chem, since they don't allow programmable calculators. My only gripe is that it sometimes doesn't register some of my button presses, which can be a bit annoying when doing a long problem.","March 1, 2018",the United States
3010,4.0,Great calculator,"Great Calculator at a great price. It works so well for my stats class. I bought it in pink hoping it would be easy to find and easy to differentiate from other classmates, I then went to class and saw that every other girl had one, If i had known that i would have chosen a color that reflected my personality a bit better. Oh well. Good buy.","January 30, 2014",the United States
3011,5.0,Perfect for us,Functional and easy to use,"October 7, 2018",the United States
3012,4.0,Ok,"Buttons are a bit sticky, but for a fairly inexpensive calculator, I'll deal with it","March 9, 2020",the United States
3013,4.0,Does the job!,It works for what I  need it for! Pretty easy to use (for as much as I know how to use a scientific calculator!) for the most part!,"March 26, 2013",the United States
3014,5.0,Five Stars,"works great, my daughter loves it for school","August 26, 2016",the United States
3015,4.0,Its a calculator,"Its a calculator. It calculates. Its able to stay on solar power in my dark room using my 45w desk light. It doesnt do graphing, but what do you expect for this price? It helped me out in college algebra and now sits in a drawer. Thank you mister calculator, you served me well.","August 20, 2015",the United States
3016,5.0,Five Stars,"Item was in excellent, new condition.","August 16, 2016",the United States
3017,4.0,Late shipping,The shipping was late even with 2 day shipping. I was supposed to get it on a monday but received it on a Thursday. The product on the other hand is perfect and does what its suppose to.,"August 28, 2018",the United States
3018,4.0,Good but buttons are hard to press at times,Easy to learn but I hated the buttons. They seemed sticky so that you’d hit a number and it wouldn’t take.,"August 26, 2019",the United States
3019,3.0,I like it but I was only able to use it ...,"I like it but I was only able to use it for one semester and a half before the buttons started sticking and giving me issues. I currently have to really push down on the numbers to get it going because if you don't, it'll type partial and of course, you get the wrong results. I'd rather spend more money next time and get a better quality device.","August 2, 2018",the United States
3020,5.0,Five Stars,Great calculator shipped quickly!,"September 19, 2016",the United States
3021,4.0,Great calculator &amp; customer service!,Came quickly. But the number 5&amp;6 didn’t work. They sent me a new one within two days and let me replace it for free. This one works great!,"May 13, 2021",the United States
3022,3.0,Missing Print?,The standard go to calculator! Normally this would be 5 stars but the one I received didn't have the 2nd functions printed... Not being able to immediately know what buttons to press was a instant deal breaker. So I sent it back. If it has the actual print on it then 5 stars easy... My professors would usually have these to use in class but I'm all online now so I need my own for the homework! Fully functioning this easy to use calculator will get you through all of high school and most of college until you need to graph.,"January 30, 2015",the United States
3023,3.0,Texas Instruments Calculator,"I got this for high school and i got it used from a different seller. It didn't include the cover, so that disapointed me. However, it does work and it is acceptable used condition. Another problem i had was there were scratches on the screen and i did not like that.","September 3, 2013",the United States
3024,5.0,Great calculator for the cost!,Basic Scientific Calculator,"July 10, 2019",the United States
3025,4.0,Happy,I like it but I wish the manual would be more clear on how to use it,"May 31, 2020",the United States
3026,4.0,Good Calculator for the Price,"I bought several of these for general use at a machine shop. Price was right. Display is easy to read and functions like most scientific calculators. The buttons are fairly tall. That is why I did not give it a 5-star rating. Otherwise, low-profile buttons would have put it over the top.","July 7, 2014",the United States
3027,4.0,I'm happy with Amazon,Same calculator I already have differentcolor different priice. So now I'm orderingA different one. This one is cheaper butcould be different with maybe morefunctionality so I'm happy. Thank you.,"May 2, 2013",the United States
3028,4.0,like  this  item,always room for imrovment  dont know what it is  tho,"May 31, 2020",the United States
3029,2.0,Not good after a few weeks use.,Was great for 6 weeks and now works poorly. Many of the buttons aren't working when you press them. I thought Texas instruments was a good brand but maybe this a fake.  I have to purchase a new calculator and will do so in store next time. I would not recommend this.,"July 6, 2021",the United States
3030,4.0,Great for algebra,I got this calculator for my college algebra 2 class. It works great and has all the buttons that I need to get through my class. It was a little difficult to understand at first. After I got the chance to play with it a little then I finally got the hang of it.,"December 13, 2015",the United States
3031,5.0,Great for Middle School math,"Ordered for my daughter to use in school. The two-line display is a big improvement over the other calculators we had, and the blue color was a plus.","January 5, 2011",the United States
3032,5.0,Easy to use,Just what I needed to pass my algebra class,"March 31, 2019",the United States
3033,3.0,Iffy buttons.,My school uses tons of these. The buttons don’t always enter their input the first time.,"September 17, 2021",the United States
3034,4.0,Easy to use. Hard to see from an angle,Perfect for my college math class that did not allow graphing calculator. Hard to read unless you are right over top of it though.,"December 20, 2019",the United States
3035,3.0,"It’s inexpensive, some of the buttons you have to press harder than others","This will get you by, you have to press the keys slower and harder than on a nicer calculator- I have a TI-83 that I use all the time, I got this to keep at work so I can have my TI-83 in my backpack - I miss having it at work badly. If you have a bit more money you can spend on a calculator I’d do it, if you’re really not going to use it much then this one will do.","October 6, 2018",the United States
3036,4.0,I am pleased with my purchase,"Calculator works great, fine condition. But it arrived in grey, which was not advertised. I prefer the grey, but was not expecting it.","January 6, 2019",the United States
3037,4.0,Required by the school,This is the calculator our school district requires for 7th grade.  It's cute and it works as expected.  A good value for the price.,"January 9, 2019",the United States
3038,4.0,"nice case, all the functions you need (just wish ...","Works well, nice case, all the functions you need (just wish there was some way of knowing how much charge battery has left [or does it charge via little solar panels at top?])","April 2, 2018",the United States
3039,4.0,good calculator but didn't get the one pictured,"The calculator works great but we were disappointed the one we received was pink but did not have the flowers on it.I know that sounds dumb, but I could have bought the same pink one in the store, but my daughter love the flowered one and I thought it might help to keep it from getting mixed up with other kids.(this was on the school supply list). There were other colors to choose from so I thought I would get the one pictured. It is a good calculator though which is what is important.","September 15, 2013",the United States
3040,4.0,Works well!,It works well! The only complaint I have about it is that the buttons arent very sensitive so they don't register the number when I press it.  I type fairly fast and my touch is a bit lighter so that's probably why. Everything else works fine :),"November 9, 2015",the United States
3041,4.0,Good calculator at a reasonable price.,"I bought 2 of these-one for my 9th grade daughter (Algebra) &amp; one for my 7th grade son (Pre-Algebra). Looks like it'll work for them through Geometry &amp; probably Trigonometry. After that they might need a TI-83 for the graphing capabilities, but given the cost of that &amp; the greater than likely probability of one of them losing or destroying the calculator before then, I figured this was the better option for now. This is definitely a good calculator at a good price.","February 15, 2010",the United States
3042,2.0,It was affordable and has all the functions I need ...,"It was affordable and has all the functions I need, but I can't get used to the order in which numbers and function must be entered.  It is not intuitive for me.  I bought it because it closely resembles in appearance a TI calculator I have owned for years, but the order in which numbers and function must be entered is completely different.  I don't know why they changed that.","May 7, 2018",the United States
3043,4.0,Good Value,Works great for my daughter as she uses it when working on Algebra. Great choice of colors too!,"December 30, 2019",the United States
3044,4.0,Does the job,"The calculator is in pretty good condition and seems to fully function. The keys take some extra pressure to work and screen has very minor abrasions. However, if you're worried about buying a used calculator, the new scientific ones aren't very expensive anymore.","October 12, 2014",the United States
