,rating,title,comment,date,country
0,5.0,This is a good calculator through high school and beyond.,"As a chemist I use a programmable graphing calculator.  However I also tutor high school and college students and have used TI 30 series calculators for that purpose for decades.  This calculator is more than adequate for junior high school, high school and most college courses.  In addition it is a bargin.  Most standardized tests and teachers who allow calculators for tests allow the TI 30 series.  It handles calculations found in all high school courses.  It comes with a rudimentary instruction sheet and a quick reference card.  TI used to package a comprehensive paperback book with this series.  That manual is still available online in pdf format as a free download.The package includes the calculator.  It has an internal battery that can be replaced with some difficulty.  Routinely the calculator relies on a solar cell which operates the device and charges the battery.  Classroom light is sufficient to power the solar cell.  There is a hard case that slides on to protect the face of the calculator.  When not in use the cover can slide on the back for storage.  There is a slot in the case to hold the quick reference card.  There is also a basic information sheet in the package.For those who worry about such things this is built in the Philippines.  The TI 30 series has been one of the most popular entry level scientific calculators since the 1970s.","October 7, 2019",the United States
1,5.0,"Finally, a color that matches my coffee-loving soul","Do you ever have problems with people recognizing that you're female?  Do people ever have the gall say that you're a ""reasonable"" and ""practical""  person?  Finally, are you tired of people mooching off you by asking to use your calculator?  If this has happened to you or someone you love, buy this calculator in this obnoxious pink color immediately!No one will be able to mistake you for anything but the pink-loving, somewhat basic girl that you are, and best of all, many, due to their masculinity complexes, will not want to use your calculator merely because of the bright color!But in all seriousness, I bought this because someone stole my factory-color blue version.  I bought this to be a little more distinctive so that maybe it won't happen again.As for the product, package came fast, all buttons work sharply -- good feedback when pressed.  I personally love this calculator -- I can't stand a casio.  TI all the way.  I can actually see what I'm taking the logarithm of instead of getting an error once I hit the log button.  I would buy this a thousand times over (if I weren't already broke of course)Enjoy!","September 25, 2017",the United States
2,3.0,NOT recommended for test taking!,This is a fine calculator. It works great. Has more functions than I'll probably ever use. Then why do I not recommend it?There is a design flaw.I have attached 3 photos where you see the screen. You'll notice that when you turn the calculator on and look at it from an angle (as you would if you kept it on a desk while you were testing) the numbers are not legible. Your line of sight has to be almost perpendicular or direct to see it clearly. This does not affect the function of the calculator but it gets inconvenient when you have to hover over the calculator or lift it up to read it. In a test taking setting this constant movement was suspicious enough to warrant a warning from the proctor.,"September 14, 2017",the United States
3,5.0,"All-round Workhorse for Algebra, Trigonometry and Chemistry","Excellent calculator, I use it for university level algebra, trig and chemistry and it has so far held up to the constant workout and being carried around in my book bag and occasionally dropped. This is the version of calculator that my university's Math Department allows for test taking. ""higher"" level calculators that graph are not allowed.","July 13, 2018",the United States
4,5.0,Great Value,"I recently purchased this calculator to have at home. I’ve been teaching middle school math for a couple decades and this is the calculator we’ve used. It is reliable, can withstand repeated falls on tile floors, and daily use by ms aged students. It has more capability than most of us will ever use, but may lack some features needed for higher level college/specialized math. The two line helps to verify inputs.  The slide off case is handy far transport and storage. It has a few quirks. The display is large enough but unreadable as the viewing angle increases. It provides “syntax error” when using a negative number in the denominator with the Ab/c function and a few other situations. I went through school before calculators so these aren’t problematic for me, but might be for today’s students.  The reliability, durability, longevity, and capability at this price makes this a great value. I like it.","October 24, 2020",the United States
5,5.0,"Good scientific calculator for high school, SAT, ACT","This calculator is a good one for use in a high school science class.  I recommend it for my chemistry and physics students because it covers all of the functions we use, and it is inexpensive.  I had to get used to the syntax for operations, because it seems backwards from my older calculators.  You must type in equations as they read on paper.  For example, if you want to do the equation 1.7 X sin55, you would literally type everything in in exactly that order.  On some of my other scientific calculators I would have to type in the 55 and then hit the sine button.  I'm not sure if one way or the other is better, but with a little practice this is a very good calculator.","November 13, 2019",the United States
6,5.0,Great calculator with all you need.,"from high school.  I've only had it for a few weeks, but I'm already impressed with how easy it is to work with.  I'm particularly impressed with it's statistical capabilities--I would have thought you would need a more of a heavy duty graphing calculator to do some of the things I've been able to do with this little guy.","May 5, 2016",the United States
7,5.0,Great for middle school!,"An absolute classic of a calculator. I used maybe this exact same model over a decade ago in school, and just purchased this one for my niece in 6th grade. It has a nice big display that makes it easy to see and every function that she will need for the next few years. It is also approved for any state testing. I don't know if the graphic calculators are allowed yet, but they weren't when I was in school.","September 22, 2016",the United States
8,5.0,Ok,"I learned to use Casio, so when my professor told me I have to use this one I was in pain. It’s ugly to look at and type numbers. It hurts… or maybe that is my hatred for anything algebra.I mean to write, it is just a calculator. It works is all I can say. Still Casio is better, easier, and not an ugly barf blue. Looks like what barfed blueberry’s would look like. If that is a concern then choose a different color. Casio in my opinion is easier to learn. But that is bc that is the one I learned first. But I do know for a fact Casio is better organized.","April 9, 2022",the United States
9,5.0,Cheap and gets the job done,"I used this calculator for the third and final exams of a trigonometry class, and it worked very well.  The math coordinator only allows devices that will allow checking answers (but don't give an exact answer).  I really don't have any dislikes, but I do like its sturdiness - this thing will take a beating.  I'm not very good at math and I start getting easily frustrated after I've been working on it for too long.  One of those occasions found me trying to destroy the calculator by  slamming it on a hard floor and then stomping it.  To my surprise it kept working...no cracked/garbled display, and all of the keys remained functional.  This is a simple, low-cost calculator that does what it's supposed to do and can take a good beating.","December 3, 2019",the United States
10,5.0,I needed a new scientific calculator,"I needed a new scientific calculator and this unit fit the demands I require of a calculator. My smartphone had these functions but I needed a calculator I could keep on my desk in the light and could be used without interruptions, such as an incoming call. The price for this calculator was very low and that made the purchase of this calculator my best choice.","July 17, 2022",the United States
11,5.0,Great little calculator,"I needed a basic calculator for my grad school work to crunch some survey and research numbers/data. This little thing fit the ticket and is very versatile. I remember using one throughout grade school and high school and it hasn't changed a bit since then. Same, tried and trued design. If you don't need graphing capabilities (and I don't) then this is a great tool.","May 31, 2022",the United States
12,5.0,Faithful and reliable,I have had this exact calculator for over 20 years.  I'm a pharmacist and use my calculator daily.  I finally had to replace it after 20 years and bought the exact same one!,"July 29, 2022",the United States
13,5.0,"Good, approved scientific calculator","This is the calculator that our Chemistry teacher approved for our Graduate Chem Course.I have used all kinds of calculators from the simplest one to TI84s.This is the best calculator for students who like to write out entire equations(instead of a multi-step process, i.e. (1x3x5)^4 rather than 1X3, then 2x5.....) It provides a 2-line view meaning after you punch in the equation, you are able to see the answer as well as what you input. You also have the option to edit your original input. And if you're like me and are always making careless errors this calculator is for you.I consider myself pretty technological. It was pretty hard to go from all the functionalities of a graphing calculator.I have taken all my graduate school tests using this calculator. Some of the students (mostly guys) found a Casio calculator to be a good option.But as someone who needs to be able to double check, edit, and double check answers again. This was the best option for me.Also, it's solar powered so no dead batteries here.","November 19, 2015",the United States
14,5.0,The White One is Awesome,"I really, really don't like the fact that I was required to buy this calculator for a Calculus class that I never wanted to take, but this totally does what it's supposed to do.I got the white one, which was totally a good idea for an extra $2 or whatever it was. I've seen it laying around several times and thought ""I wonder if I lost my calculator...?"" and then I check my bookbag and it's totally mine. If you would prefer to not lose the one thing keeping you from having a breakdown in your math class, opt for one of the less common colors.People complement my white calculator all the time, and honestly out of my class of 200 college kids, I've never seen another one.","March 11, 2017",the United States
15,5.0,Calculator recommended for middle school,"Durable case keeps it protected. The blue color is very nice. It works well, and it is the scientific calculator recommended for our middle school student. The brand is well known and makes great calculators. The instructions are to the point and thorough. Great calculator at a great price!!","July 5, 2022",the United States
16,5.0,recommended by Algebra II teacher,"My son is in 10th grade taking Algebra II and this specific model and brand was recommended by his teacher so all my son had to do is a pick the color and it was delivered in fast 2 days, thanks to Amazon Prime.I do like that it works on battery as well as solar power so as long as there's enough indoor lights, which will save battery life.  It's very sturdy and it comes with a protective case that can be snapped back of the calculator when in use.THE BOTTOM LINE:5 out of 5 stars.  Highly recommended.  Hope this helps and let me know if you have any questions.","September 25, 2019",the United States
17,5.0,"I've actually owned several of these!  If you can't use a graphing calculator, then this is the model to use.","This model from Texas Instruments was the gold standard for me throughout algebra and then again in graduate school.  For calculus and pre-calculus, I switched to the TI-89 graphing model.  After a certain point in school, the graphing calculator becomes unnecessary for daily needs (and not allowed).At that point, I purchased another one of these TI-30's.  This calculator has all of the basic functions along with the logarithmic functions (ln and log).Advantages:-Calculator is portable, reliable.-Many standardized tests will not allow graphing calculators.  In that case, this is the calculator to use.-The buttons are well spaced (much better than those small, solar powered, small blue calculators).-No additional batteries required (solar powered).Disadvantages:-If you are in high level calculus, you will likely need and want graphing functions.  Otherwise, this is a much more reliable and portable calculator.-If you are in high level financial courses, you will likely need a financial calculator.  The financial calculator lacks the logarithmic functions but includes the rate and time (present and future) values of money.","June 24, 2013",the United States
18,5.0,Calculates,"I got this to use for my college algebra class and it has been excellent. I went with pink because it was the cheapest color. No regrets.Update: I have used this calculator for over a year now and it has never disappointed me. It got me through a college algebra class perfectly fine. Currently, it is still going strong through calculus and trigonometry (via a precalculus class). It doesn't graph - but for what I paid it has done everything else. I'm so happy with it that I bought one for my fiancee so we don't have to fight over this one while doing math together. So far, I haven't really found a function it wasn't able to do and with a statistics class in the lineup, it looks like this will be another very useful tool. I never thought I would be reviewing a calculator.","November 2, 2018",the United States
19,5.0,Will get you through any class that doesn't require graphing,"It's easy to use and learn, but I got this as a backup for my classes that don't require a graphing calculator and coming from a backlit screen to this means it can be kind of hard to read sometimes since it doesn't have a backlight. That being said I used a calculator just like this all throughout high school with no problem. And for the price I'd have gone with this one over a graphing calculator every time if my calc classes didn't require a graphing calculator. I also love the color!","November 22, 2020",the United States
20,5.0,THRILLED !!,"My son absolutely LOVEloveLOVES his calculator, uses it daily, and most sincerely akd sweetly thanks me again akd again for it daily !! He is “ o my” just shy of being 12 years old , however is working at about two full grades ahead of his classmates in math and reading skills, so, we are all very pleased with this purchase and he’s BEYOND thrilled with this product ... and already has a couple more fancy versions on his birthday wishlists 😁I’m positive he is going to be one of Texas Instruments’ life long loyal customers !! 💜","February 9, 2020",the United States
21,5.0,The best for my math students!,"I love this calculator. I have taught 7th grade math for years, and this is the calculator I choose for my kids. We can do so much with this calculator. A large poster in my classroom that was free from the company is very helpful","June 27, 2021",the United States
22,5.0,These calculators are handy. I'm a math major and ...,"These calculators are handy. I'm a math major and purchased this for a work related class, as they wanted to instruct on a scientific calculator, but not a fancy or costly one. I've been impressed and carry it around with me still. I have a TI-83plus and a TI-NSpire CAS, but this one still fits a niche. This particular blue calculator was a second purchase for my daughter for high school geometry class. She loves it.","October 11, 2017",the United States
23,5.0,My Favorite Calculator,"This is my favorite calculator. I am on my second one of them (one of them lasted through engineering school and finally had to put to rest when the screen broke after 5-6 years heavy use with things like 8 hour exams). I also requested that I get 2 for work, one for my desk in the office and one for my bench in the laboratory. For the price, this is an excellent calculator, and if you put in the time to learn the functions it can do quite a bit (calculates averages, standard deviations, and more).Also, I did try to switch to an app on my phone at one point, but none of them compare in functionality with a real scientific calculator, and usually phones are prohibited during exams.One other thing - this calculator is on the approved list for the Oregon Fundamentals of Engineering Exam as well. I wouldn't trust any other calculator (graphing calculators not allowed) to get me through that, and it did just fine.","July 21, 2014",the United States
24,5.0,"Great Price, Great Value","Like others have posted this is not as pictured.  The design is not the floral or the geometric as the two pictured.  The design part in these pictures is all white on the calculator I received.  If this is a big deal to you, you may want to go to a store where you can pick the design you want.  For me the pink color met my requirements.A great basic non graphing scientific calculator at a great price.  My school bookstore charges $20 for these and only has them in black.  Pink makes it stand out so you know it is yours and makes doing math more fun!It is solar powered with a battery back up.  It has a cover that snaps on the back when you dont need it shut, and there is a cheat sheet for the functions that is in the cover.  I love Texas Instruments, they make products meant to last.  This is a nice quality plastic making it very durable and last a life time.Cannot beat the price, and Prime 2 day free shipping.  Always looking to save a buck.","January 10, 2013",the United States
25,5.0,Real good math thingey,"This calculator can add stuff...like numbers. It can also subtract stuff...also numbers. I ain't used me the other symbols like the ""X"" and the line with the dots over and under it cuz they scare me. But I might've got me a cousin once who knowed how to use all them fancy symbols...he went to fifth grade...grandpappy seys he was the smartest one of the litter. I used to like to thump him. But now I got me a real fancy calculator so I bet he ain't laughing no more!","June 29, 2021",the United States
26,5.0,Good calculator,"Came on time and no damage present. I have prime so this came quickly.I need this for college, since some classes don't allow the use of a graphing calculator. I like this better than the TI-30a because it has the 2 line view.My school also sells it at their bookstore but it's $5-6 more than the price on Amazon, which is why I went with Amazon.I like using Texas Instruments calculators, because they're pretty good. I have a TI-84 plus and I've been using that since middle school.","February 1, 2017",the United States
27,5.0,Just Right for Teaching Chemistry Classes ...,"When working properly, these are wonderful calculators: affordable, simple to learn, fuctional, small, comes with case, easy to reset the memory, etc.It's not as bulky or expensive as something like the TI-89 and on series of graphing calculators.I recommend these calculators for all my chemistry classes. I've never had to use the sin, cos, and tan buttons, but one feature that is especially useful in science class is the ability to shift between scientific notation and normal notation (end, sci/eng, right, enter). It sounds more complicated than it really is and once you do it once, you'll be fine.Occasionally, there are individual calculators that will have poorly made buttons that stick a little. In that case, you have to be extra careful when inputting data, but usually this gets fixed with enough use.Conclusion: Good choice for science class.","June 1, 2014",the United States
28,5.0,School Supply Necessity,This type of calculator was on my son's 6th grade school Supply list. I was happy to see that Amazon had it for a very good price in a variety of colors. My kiddos is not so mad about math because of his Sonic blue calculator.,"August 10, 2022",the United States
29,5.0,Engineers can have pink too,"As an engineering student, I have to take a lot of math course. My calculus course allowed us to use a calculator - but of course not the fancy graphing one.I had gone all around my college town searching for this calculator. Seems like everyone needed it.Figured I’d give amazon a go and it was much cheaper - and in pink! No more getting confused whose is whose!So far, I love how it shows what I’ve typed in as a 2 line calculator. Some don’t show what you’ve previously typed in and you have to hope you pressed the right button!It’s also so easy to figure out.","December 3, 2018",the United States
30,5.0,Excellent,I purchased this for a physics class I was taking and it works great and did everything I needed it to do. Lot's of great videos on teh internet to learn how to use it. Terrific price for a name brand. I'm happy with my purchase and would purchase it again.,"May 16, 2022",the United States
31,5.0,Great calculator,"I like my gadgets to be colored differently from the normal grey and black and I needed a scientific calculator to grade statistics papers, so I bought this one for cheap.  I don't know what I can say - it's a great scientific calculator.  Has all of the functions that are necessary for me - sine, cosine, tangent; fraction to decimal; probability functions; several statistical functions (to the point that we don't actually allow this calculator on our statistics exams; it solves the mean, standard deviation and variance for a list of variables) and others.  There's a little card inside the cover that tells you how to perform these functions.  And it's pink!  I'm the only one with a pink calculator so I know it won't disappear.Only note - it's not exactly as pictured.  The window around the screen doesn't have any pink flowers on it; it's just white.  Other than that, it looks like the picture.","August 25, 2013",the United States
32,5.0,Great Quality,"I bought two of these for my 2 homeschooled middle schoolers to have as they venture into algebra and they’ve been great. I used Texas Instrument back in my Calculus days and when it came time to get my kids a good, durable calculator to last, there just wasn’t any question about it. This calculator is easy to use, displays your equation on the screen, and is good quality. This will last them through Algebra, Chem, and up until pre-Calc, when we will have to upgrade to graphing calculators. Very happy with these good looking, durable calculators.","February 26, 2020",the United States
33,5.0,Great calculator for students!,"I used this calculator for college-level chemistry and statistics. It was exactly what I needed, since more advanced versions  (TI-89s) weren't allowed by my professors. Even now that I've graduated, I still have this calculator on hand for every day tasks since it's more user friendly and practical than other models. Still works like a charm!","September 15, 2021",the United States
34,5.0,The next best thing to a TI-8X series graphing calculator,"The next best thing to a TI-8X series graphing calculator, for when you don't need or can't use a graphing calculator. No longer will I be forced to chose between hauling out the TI-89 or using free promotional item calculators that don't even do order of operations correctly. The fact that the TI-30X has more complicated functions than a standard desktop calculator is a great feature that discourage moderately stupid people from 'borrowing' it.","July 12, 2017",the United States
35,5.0,Best calculator for the money,"Needed a calculator for some science classes that do not require advance math functions...Chemistry, Biology, etc.  I was afraid that I would have to drop some serious $$$ on a scientific calculator but this one is pretty inexpensive and does everything I could have asked for.  Really though, except for the basic functions every calculator performs, I have only used the parenthesis and exponent functions often but I can say that they work well.  Also, the ""SCI"" mode helped me a lot with scientific notation problems.  Plus it is a TI, so I know it will last.  Unless you are about to embark on a deep mathematical journey or really need graphing functions, this calculator will rock your socks (as much as a calculator can).","March 23, 2015",the United States
36,5.0,Cool little calculator,"Cool little calculator, one downfall though, you have to look straight down on it to read the display clearly, you can't look at it from an angle, you won't be able to see the numbers correctly, I guess it's the way the LED display is designed, other than that, good little calculator!","July 20, 2021",the United States
37,5.0,Perfect match to my kids school supplies list,I was shopping for school supplies using the list provided by the school for my 5th grader.  They mentioned this model specifically as a suggested calculator.  Unfortunately when we went to Target they only had 3 pink ones left.  My boy didn't want a pink calculator.  Amazon saved the day by delivering it before school started and saving me a couple dollar over the Target price.I didn't use the calculator so I cannot comment on the functionality.  I have had good luck with Texas Instruments in the past so I assume it will work fine.,"September 5, 2018",the United States
